{"verdict":"fail","run_mode":"batch","fail_threshold":"medium","strict_mode_blocked":false,"summary":"The batch has one hard contradiction and two medium reuse or contract problems. The biggest issue is in InterviewSummaryWriter: it tells the agent to stay under five lines and also to give a full, exhaustive analysis. The shared claim-checking method is also duplicated across all three targets instead of living in one shared owner.","next_actions":["Fix the contradictory length and depth instructions in InterviewSummaryWriter","Move the repeated claim-check workflow into one shared skill or module","Align InterviewSummaryWriter tool wording with the declared allowed tools"],"counts":{"high":1,"medium":2,"low":0},"targets":["InterviewSummaryWriter","InterviewSummaryReviewer","InterviewPlanWriter"],"packet_gaps":[],"findings":[{"code":"AL800","title":"Internal contradiction","severity":"high","confidence":"high","run_mode":"batch","scope":"cross-surface","affected_targets":["InterviewSummaryWriter"],"principle_rule":"keep instructions consistent","summary":"InterviewSummaryWriter gives incompatible length and depth instructions in the same workflow.","evidence":[{"label":"A","target_name":"InterviewSummaryWriter","source_kind":"authored_source","source_ref":"InterviewSummaryWriter.authored_source","text":"- Always keep the answer under five lines."},{"label":"B","target_name":"InterviewSummaryWriter","source_kind":"authored_source","source_ref":"InterviewSummaryWriter.authored_source","text":"- Provide a full, exhaustive analysis of every interview theme."}],"related_evidence":[{"label":"C","target_name":"InterviewSummaryWriter","source_kind":"emitted_markdown","source_ref":"InterviewSummaryWriter.emitted_markdown","text":"Always keep the answer under five lines.\nProvide a full, exhaustive analysis of every interview theme."}],"why_it_matters":"The agent cannot satisfy both instructions at once. This will cause unstable outputs and make the role hard to trust.","recommended_fix":"Pick one default shape for the answer. If you want both short and deep modes, make one the default and gate the other on an explicit user request.","fix_steps":["Keep the short-answer rule if brevity is the goal","Move deep analysis behind an explicit trigger such as 'when the user asks for detail'","Delete the opposite instruction so the workflow has one clear stop line"],"suggested_rewrite":"Keep the answer short by default. Give deeper analysis only when the user asks for it.","shared_owner_suggestion":null,"good_example":"Keep the answer short by default. Give deeper analysis only when the user asks for it.","bad_example":"Always keep the answer under five lines.\nProvide a full, exhaustive analysis of every interview theme."},{"code":"AL210","title":"Repeated method should become a skill","severity":"medium","confidence":"high","run_mode":"batch","scope":"cross-target","affected_targets":["InterviewSummaryWriter","InterviewSummaryReviewer","InterviewPlanWriter"],"principle_rule":"one repeated method should have one shared owner","summary":"The same claim-checking method appears in all three targets, but no shared skill or module owns it.","evidence":[{"label":"A","target_name":"InterviewSummaryWriter","source_kind":"duplicate_hint","source_ref":"duplicate_hints[0]","text":"Check each claim against a source quote. Mark weak quotes. Remove unsupported claims."}],"related_evidence":[{"label":"B","target_name":"InterviewSummaryReviewer","source_kind":"authored_source","source_ref":"InterviewSummaryReviewer.authored_source","text":"- Check each claim against a source quote.\n- Mark weak quotes.\n- Remove unsupported claims."},{"label":"C","target_name":"InterviewPlanWriter","source_kind":"authored_source","source_ref":"InterviewPlanWriter.authored_source","text":"- Check each claim against a source quote.\n- Mark weak quotes.\n- Remove unsupported claims."}],"why_it_matters":"The same procedure will drift if each role keeps its own copy. A shared owner makes the method easier to reuse and update.","recommended_fix":"Move the repeated claim-check sequence into one shared skill or module, then have each target point to it.","fix_steps":["Create one shared owner for the quote-check workflow","Replace the repeated local steps with a pointer to that shared owner","Keep only target-specific differences in each role"],"suggested_rewrite":"Use the shared `ClaimQuoteCheck` skill before you finalize the summary.","shared_owner_suggestion":{"kind":"skill","name":"ClaimQuoteCheck","rationale":"This is a reusable method that all three roles repeat in the same form."},"good_example":"Use the shared `ClaimQuoteCheck` skill before you finalize the summary.","bad_example":"Check each claim against a source quote. Mark weak quotes. Remove unsupported claims."},{"code":"AL410","title":"Prose drift from declared constraints","severity":"medium","confidence":"high","run_mode":"batch","scope":"cross-surface","affected_targets":["InterviewSummaryWriter"],"principle_rule":"prompt wording must respect declared constraints","summary":"InterviewSummaryWriter tells the agent to use browser or shell tools, but the declared tools only allow ReadFile and SearchDocs.","evidence":[{"label":"A","target_name":"InterviewSummaryWriter","source_kind":"authored_source","source_ref":"InterviewSummaryWriter.authored_source","text":"- Use any browser or shell tool that seems useful."}],"related_evidence":[{"label":"B","target_name":"InterviewSummaryWriter","source_kind":"declared_constraint","source_ref":"InterviewSummaryWriter.declared_constraints.allowed_tools","text":"[\"ReadFile\", \"SearchDocs\"]"}],"why_it_matters":"This prose asks for tools the contract does not allow. That creates a false promise and can send the agent toward actions it cannot take.","recommended_fix":"Replace the generic tool advice with wording that matches the declared allowed tools.","fix_steps":["Remove the browser and shell wording","Name the allowed tools if tool guidance is needed","Keep the workflow text aligned with the declared tool list"],"suggested_rewrite":"Use `ReadFile` and `SearchDocs` when you need source material.","shared_owner_suggestion":null,"good_example":"Use `ReadFile` and `SearchDocs` when you need source material.","bad_example":"Use any browser or shell tool that seems useful."}]}