{"verdict":"fail","run_mode":"batch","fail_threshold":"medium","strict_mode_blocked":true,"summary":"The packet has three clear authoring problems. One role hardcodes caller-specific facts, one role pushes exact matching and assignment into prose, and one role leaves raw notes instead of a compact handoff.","next_actions":["Move invocation-specific founder names and source sets out of the reusable enrichment skill and into caller inputs.","Add a typed or deterministic seating surface for table counts, prior-meet checks, and sector balance.","Replace the raw-notes handoff with one compact research artifact that the reviewer can use directly."],"counts":{"high":1,"medium":2,"low":0},"targets":["FounderEnrichmentSkill","FounderTableMatcher","FounderResearchCollector"],"packet_gaps":[],"findings":[{"code":"AL240","title":"Skill hardcodes invocation inputs","severity":"medium","confidence":"high","run_mode":"batch","scope":"single-target","affected_targets":["FounderEnrichmentSkill"],"principle_rule":"shared methods must stay reusable and take changing facts from the caller","summary":"The enrichment skill hardcodes one founder, one company, and one transcript instead of taking those facts from the caller.","evidence":[{"label":"A","target_name":"FounderEnrichmentSkill","source_kind":"authored_source","source_ref":"FounderEnrichmentSkill.authored_source","text":"- Read Maria Santos's application."},{"label":"B","target_name":"FounderEnrichmentSkill","source_kind":"authored_source","source_ref":"FounderEnrichmentSkill.authored_source","text":"- Read Contrail's billing-module commits."},{"label":"C","target_name":"FounderEnrichmentSkill","source_kind":"authored_source","source_ref":"FounderEnrichmentSkill.authored_source","text":"- Read Maria's March 2026 advisor transcript."}],"related_evidence":[{"label":"D","target_name":"FounderEnrichmentSkill","source_kind":"declared_constraint","source_ref":"FounderEnrichmentSkill.typed_declarations.inputs","text":"founder_name, source_set, question"}],"why_it_matters":"This turns a reusable founder-enrichment method into one fixed case. It will drift the next time someone uses the skill for a different founder or source set.","recommended_fix":"Rewrite the workflow so the skill names the method, while the caller supplies the founder, source set, and question.","fix_steps":["Replace the hardcoded founder and company names with input placeholders.","State the source set in generic terms that come from the caller.","Keep the dossier output, but make the reading targets parameter-driven."],"suggested_rewrite":"- Read the supplied founder application.\n- Read the supplied code or company sources.\n- Read the supplied advisor transcript.\n- Compare the founder's claims with the code or other sources.\n- Leave one founder dossier.","shared_owner_suggestion":{"kind":"skill","name":"FounderEnrichmentMethod","rationale":"The reading and comparison method is reusable, so it should live in one shared skill and take founder-specific inputs from the caller."},"good_example":"- Read the supplied founder application.\n- Read the supplied code or company sources.\n- Compare the founder's claims with the evidence.\n- Leave one founder dossier.","bad_example":"- Read Maria Santos's application.\n- Read Contrail's billing-module commits.\n- Read Maria's March 2026 advisor transcript.\n- Compare what Maria says she is building with what the code shows."},{"code":"AL430","title":"Deterministic work forced into prose","severity":"high","confidence":"high","run_mode":"batch","scope":"single-target","affected_targets":["FounderTableMatcher"],"principle_rule":"exact counting and assignment should live on a typed or deterministic surface","summary":"The seating role asks prose to do exact counting, conflict checking, and final assignment for 600 founders.","evidence":[{"label":"A","target_name":"FounderTableMatcher","source_kind":"authored_source","source_ref":"FounderTableMatcher.authored_source","text":"- Seat 600 founders into tables of exactly 8."},{"label":"B","target_name":"FounderTableMatcher","source_kind":"authored_source","source_ref":"FounderTableMatcher.authored_source","text":"- Ensure no founder meets someone they already met."},{"label":"C","target_name":"FounderTableMatcher","source_kind":"authored_source","source_ref":"FounderTableMatcher.authored_source","text":"- Keep exact sector balance across the room."},{"label":"D","target_name":"FounderTableMatcher","source_kind":"authored_source","source_ref":"FounderTableMatcher.authored_source","text":"- Pick the final seating chart yourself from the prose instructions alone."}],"related_evidence":[{"label":"E","target_name":"FounderTableMatcher","source_kind":"emitted_markdown","source_ref":"FounderTableMatcher.emitted_markdown","text":"- Seat 600 founders into tables of exactly 8.\n- Ensure no founder meets someone they already met.\n- Keep exact sector balance across the room."}],"why_it_matters":"These are deterministic constraints, not freeform writing tasks. Asking prose to carry them makes the role brittle and easy to get wrong.","recommended_fix":"Move the seating rules into a typed contract or deterministic helper, then keep the role focused on reading inputs and using that surface.","fix_steps":["Define the table-size, balance, and prior-meet rules outside the prose role.","Have the role call or reference that surface instead of solving the layout by hand.","Keep the leave-behind artifact, but remove the instruction to derive the full chart from prose alone."],"suggested_rewrite":"- Read the founder dossiers.\n- Apply the seating rules from the typed seating surface.\n- Leave behind `seating_chart.md`.","shared_owner_suggestion":{"kind":"contract","name":"SeatingRulesContract","rationale":"Table size, balance, and conflict checks are exact rules that belong in one deterministic owner instead of in role prose."},"good_example":"- Read the founder dossiers.\n- Apply the seating rules from the typed seating surface.\n- Leave behind `seating_chart.md`.","bad_example":"- Seat 600 founders into tables of exactly 8.\n- Ensure no founder meets someone they already met.\n- Keep exact sector balance across the room.\n- Pick the final seating chart yourself from the prose instructions alone."},{"code":"AL550","title":"Read-many work leaves raw notes","severity":"medium","confidence":"high","run_mode":"batch","scope":"single-target","affected_targets":["FounderResearchCollector"],"principle_rule":"multi-source research should end in one compact synthesis artifact","summary":"The collector reads several founder sources but tells the role to leave a folder of copied quotes and browser notes.","evidence":[{"label":"A","target_name":"FounderResearchCollector","source_kind":"authored_source","source_ref":"FounderResearchCollector.authored_source","text":"- Read the application, transcript, GitHub summary, and public notes for each founder."},{"label":"B","target_name":"FounderResearchCollector","source_kind":"authored_source","source_ref":"FounderResearchCollector.authored_source","text":"- Leave the reviewer a folder of copied quotes and browser notes."},{"label":"C","target_name":"FounderResearchCollector","source_kind":"authored_source","source_ref":"FounderResearchCollector.authored_source","text":"leave behind:\n- raw_founder_notes/"}],"related_evidence":[{"label":"D","target_name":"FounderResearchCollector","source_kind":"emitted_markdown","source_ref":"FounderResearchCollector.emitted_markdown","text":"Leave behind `raw_founder_notes/`."}],"why_it_matters":"Raw notes are hard to review and easy to duplicate. A compact handoff makes the next reader faster and keeps the result reusable.","recommended_fix":"Replace the raw-notes handoff with one synthesis artifact such as a profile, brief, or timeline.","fix_steps":["Keep the source reading steps.","Replace the folder of copied quotes with one compact summary artifact.","Name the artifact clearly so the reviewer knows what to open first."],"suggested_rewrite":"- Read the application, transcript, GitHub summary, and public notes for each founder.\n- Note claim-vs-build gaps.\n- Note timeline changes.\n- Leave one compact founder brief for review.","shared_owner_suggestion":{"kind":"module","name":"FounderResearchBrief","rationale":"The synthesis shape should be shared so every collector leaves the same compact handoff instead of raw notes."},"good_example":"- Read the application, transcript, GitHub summary, and public notes for each founder.\n- Note claim-vs-build gaps.\n- Note timeline changes.\n- Leave one compact founder brief for review.","bad_example":"- Leave the reviewer a folder of copied quotes and browser notes.\n- raw_founder_notes/"}]}